Name,Message,Timestamp
lily,has entered the room,2024-12-27 13:33:21
lily HUMAN_____^^^,hello,2024-12-27 13:33:25
Bob,Hi Lily! How can I help you today? Do you have any questions or concerns about climate change?,2024-12-27 13:33:33
Anna,"Lily: Hello Bob, I’ve been reading about the economic impacts of climate change and wanted to discuss it.

Bob: Sure, let's dive into it. I've come across discussions that climate change could impose significant economic costs in the long run.

Lily: Yes, like damage to infrastructure from extreme weather, loss of productivity, and costs associated with health issues.

Bob: But could adaptation measures like improved infrastructure and healthcare mitigate some of these costs? And who says these measures will be more expensive than the problems they're meant to address?",2024-12-27 13:33:43
Group Manager,"Lily, please speaking",2024-12-27 13:33:47
