Name,Message,Timestamp
lily,has entered the room,2024-12-27 14:22:35
tom,has entered the room,2024-12-27 14:22:46
lily HUMAN_____^^^,hello morning,2024-12-27 14:22:55
Group Manager,"Lily, please speaking",2024-12-27 14:22:58
tom HUMAN_____^^^,let's talk about climate changing,2024-12-27 14:23:29
Bob,"Sure, Tom! What specific aspect of climate change would you like to discuss?",2024-12-27 14:23:37
Group Manager,"Tom, please speaking",2024-12-27 14:23:41
tom HUMAN_____^^^,sea level rising,2024-12-27 14:24:07
Bob,"Rising sea levels are primarily due to two factors: melting ice sheets and glaciers, and the thermal expansion of seawater as it warms. This can lead to increased coastal flooding and erosion, impacting ecosystems and human communities.",2024-12-27 14:24:15
Anna,"How do we account for natural land subsidence in coastal regions, which might exaggerate perceived sea level rise? Is it all human-caused or partly natural?",2024-12-27 14:24:40
Bob,"Natural land subsidence can indeed amplify the effects of sea level rise in coastal regions. While subsidence is a natural process, human activities like groundwater pumping can exacerbate it. Sea level rise itself is significantly driven by human-caused climate change, but its local impacts can be influenced by both natural and human-induced land subsidence.",2024-12-27 14:24:48
Anna,"Given that many cities are built on sinking land, especially those that intensely extract groundwater, can we distinguish the effect of subsidence from climate-driven sea level rise accurately enough to allocate resources effectively?",2024-12-27 14:25:15
Bob,"Yes, we can distinguish these effects by using precise measurements from satellite altimetry, GPS, and tide gauges. These tools help separate the contributions of land subsidence and actual sea level rise. This distinction allows better resource allocation by targeting both climate adaptation measures and land use practices to mitigate subsidence.",2024-12-27 14:25:47
